### ISSUE TITLE
unsuccessful Encrypted Client Hello (ech)

### ISSUE THREAD

**Issue by LeonardWalter** [quic-go/quic-go#4980]
TLS ECH support was added in go 1.24. I can use it with the net/http client and server implementation to verify that it works. In my testing with it I do get a 200 OK response and the `http.request` does have the `TLS.ECHAccepted` flag set to true.
I tried to also use it with a quic-go/http3 client and server by only doing minimal changes to my setup. Basically, I switched out:
http.server -> http3.server 
http.Transport -> http3.Transport
but with these changes the TLS handshake is now no longer successful. 
On the http3 server this message always pops up when a client tries to connect with a populated `EncryptedClientHelloConfigList` in the `tls.Config`
`CRYPTO_ERROR 0x179 (remote): tls: encrypted client hello required`
And on the client I see the following response:
`CRYPTO_ERROR 0x179 (local): tls: server rejected ECH`

In Issue #3905 it was mentioned that ECH is 
> purely a crypto/tls issue

this makes me think that it should work with quic-go even if quic-go is still on 1.23, but it seems to me like somewhere along the line the ECH TLS extension is dropped.
Here is the setup I used [https://github.com/LeonardWalter/echTester](https://github.com/LeonardWalter/echTester)

**Comment by marten-seemann** [comment]
Have you checked the TLS messages sent with Wireshark?

**Comment by LeonardWalter** [comment]
Yes, the ECH extension is transmitted:


With HTTP2 client hello
```
Frame 4: 1648 bytes on wire (13184 bits), 1648 bytes captured (13184 bits)
Ethernet II, Src: 00:00:00_00:00:00 (00:00:00:00:00:00), Dst: 00:00:00_00:00:00 (00:00:00:00:00:00)
Internet Protocol Version 4, Src: 127.0.0.1, Dst: 127.0.0.1
Transmission Control Protocol, Src Port: 44164, Dst Port: 17443, Seq: 1, Ack: 1, Len: 1582
Transport Layer Security
    TLSv1.3 Record Layer: Handshake Protocol: Client Hello
        Content Type: Handshake (22)
        Version: TLS 1.0 (0x0301)
        Length: 1577
        Handshake Protocol: Client Hello
            Handshake Type: Client Hello (1)
            Length: 1573
            Version: TLS 1.2 (0x0303)
            Random: 5f489ce1d0cbbb8909786b68e4cac177bb3ff7e41734420a4c1a8e67915759fc
            Session ID Length: 32
            Session ID: 9d3554eeddde9d3d4dad090da60f68b714e9d8a03734620318cc47d546204b7e
            Cipher Suites Length: 6
            Cipher Suites (3 suites)
            Compression Methods Length: 1
            Compression Methods (1 method)
            Extensions Length: 1494
            Extension: server_name (len=13) name=xxxx
            Extension: signed_certificate_timestamp (len=0)
            Extension: encrypted_client_hello (len=145)
                Type: encrypted_client_hello (65037)
                Length: 145
                Client Hello type: Outer Client Hello (0)
                Cipher Suite: HKDF-SHA256/AES-128-GCM
                Config Id: 31
                Enc length: 32
                Enc: 185a49bb82906997dfd8d35e9a97d1e95654d37f61e8e8ef6014d09d98edee49
                Payload length: 103
                Payload: 7e388609ce76147bd9b46a2b580a3829cce3c07a0de94f9f38947719c7e1073f7e90bb665dacd774c905324f6b75f258eddfe32281e3a4cee3587ef97e793bf3c2e3e62cc5782ebe8b7e8d285f581cfddf379f7a6781329a100ed909ccf2ee5f2b32870611c3d0
            Extension: status_request (len=5)
            Extension: supported_groups (len=12)
            Extension: signature_algorithms (len=26)
            Extension: supported_versions (len=3) TLS 1.3
            Extension: key_share (len=1258) Unknown (4588), x25519
```

Capture from HTTP3 client hello

```
Frame 2: 1322 bytes on wire (10576 bits), 1322 bytes captured (10576 bits)
Ethernet II, Src: 00:00:00_00:00:00 (00:00:00:00:00:00), Dst: 00:00:00_00:00:00 (00:00:00:00:00:00)
Internet Protocol Version 4, Src: 127.0.0.1, Dst: 127.0.0.1
User Datagram Protocol, Src Port: 34903, Dst Port: 17443
QUIC IETF
    QUIC Connection information
    [Packet Length: 1280]
    1... .... = Header Form: Long Header (1)
    .1.. .... = Fixed Bit: True
    ..00 .... = Packet Type: Initial (0)
    [.... 00.. = Reserved: 0]
    [.... ..01 = Packet Number Length: 2 bytes (1)]
    Version: 1 (0x00000001)
    Destination Connection ID Length: 15
    Destination Connection ID: 1371cd7564b1cdcefb0cb4624c56c4
    Source Connection ID Length: 4
    Source Connection ID: 0ebb0605
    Token Length: 0
    Length: 1251
    [Packet Number: 1]
    Payload [truncated]: f22538de22e2d7879a5087df13225b56154562d96fe9dc2e3e2aad1cac62d3364cf3165bee49af28ae352985f945c84ffc547a6c7fd82822b42163de20e415582777f6453a57d2a1cfb0dc614de3901c4e8d7b9cb17dfea50b767292b548f310a139605694c6e69ed2da0b9dc4
    PADDING Length: 764
    CRYPTO
        Frame Type: CRYPTO (0x0000000000000006)
        Offset: 1229
        Length: 464
        Crypto Data
        TLSv1.3 Record Layer: Handshake Protocol: Client Hello
            Handshake Protocol: Client Hello (last fragment)
            [2 Reassembled Handshake Fragments (1693 bytes): #1(1229), #2(464)]
            Handshake Protocol: Client Hello
                Handshake Type: Client Hello (1)
                Length: 1689
                Version: TLS 1.2 (0x0303)
                Random: 8f0c329dece8fa3d3cf641d8b873d97caa3d62d973992043feef998cc06b7503
                Session ID Length: 0
                Cipher Suites Length: 6
                Cipher Suites (3 suites)
                Compression Methods Length: 1
                Compression Methods (1 method)
                Extensions Length: 1642
                Extension: server_name (len=13) name=xxxx
                Extension: signed_certificate_timestamp (len=0)
                Extension: quic_transport_parameters (len=71)
                Extension: encrypted_client_hello (len=209)
                    Type: encrypted_client_hello (65037)
                    Length: 209
                    Client Hello type: Outer Client Hello (0)
                    Cipher Suite: HKDF-SHA256/AES-128-GCM
                    Config Id: 31
                    Enc length: 32
                    Enc: af61aca54e49bbd1dd89494c7a0bb29ae65e2fed9e30a06e45df6a6199d58c5a
                    Payload length: 167
                    Payload [truncated]: cd0c7481aaacc1a919ff035e0eef236de1ac7c0d8e54bccdf7d3834cc5f559da83506a46f76d442c0a7d3a10154789759272d546390b1115966d1489b55db4725b85f81f5e281945eea6f80e5e3dc3e6712931eba054e82bdb0b9adeec1e1b7594f13ee9881ec559d5cdcc5cad
                Extension: status_request (len=5)
                Extension: supported_groups (len=12)
                Extension: signature_algorithms (len=26)
                Extension: application_layer_protocol_negotiation (len=5)
                Extension: supported_versions (len=3) TLS 1.3
                Extension: key_share (len=1258) Unknown (4588), x25519
```

So probably there is some problem during parsing on server side.

**Comment by marten-seemann** [comment]
I'm marking this as "help wanted". This will require some digging into what the standard library sees and expects, but this has really low priority for me at this point. Contributions welcome! Or alternatively, contact me if you want to see resolved soon.
