### ISSUE TITLE
Large number of QUIC PING frames observed, is this normal?

### ISSUE THREAD

**Issue by lonnywong** [quic-go/quic-go#5535]
There are a large number of QUIC PING frames shown in `qvis`, even though the application-level data sent is minimal.

Is this normal behavior in quic-go? Could it be related to idle connection keep-alives, flow control, or congestion control? What’s the recommended way to trace what is triggering these PING frames?

Additional info:

<img width="2444" height="2002" alt="Image" src="https://github.com/user-attachments/assets/461addec-33c9-4b2f-938d-a3e4d37bbe4e" />

```
19:08:26.522511 IP localhost.46686 > localhost.46570: UDP, length 25
19:08:26.522518 IP localhost.46686 > localhost.46570: UDP, length 25
19:08:26.522576 IP localhost.46570 > localhost.46686: UDP, length 29
19:08:26.553109 IP localhost.46686 > localhost.46570: UDP, length 25
19:08:26.553119 IP localhost.46686 > localhost.46570: UDP, length 25
19:08:26.553182 IP localhost.46570 > localhost.46686: UDP, length 31
19:08:26.583674 IP localhost.46686 > localhost.46570: UDP, length 25
19:08:26.583683 IP localhost.46686 > localhost.46570: UDP, length 25
19:08:26.583760 IP localhost.46570 > localhost.46686: UDP, length 33
19:08:26.613969 IP localhost.46686 > localhost.46570: UDP, length 25
19:08:26.613980 IP localhost.46686 > localhost.46570: UDP, length 25
19:08:26.614085 IP localhost.46570 > localhost.46686: UDP, length 35
19:08:26.644442 IP localhost.46686 > localhost.46570: UDP, length 25
19:08:26.644452 IP localhost.46686 > localhost.46570: UDP, length 25
19:08:26.644534 IP localhost.46570 > localhost.46686: UDP, length 37
19:08:26.674936 IP localhost.46686 > localhost.46570: UDP, length 25
19:08:26.674949 IP localhost.46686 > localhost.46570: UDP, length 25
19:08:26.675054 IP localhost.46570 > localhost.46686: UDP, length 39
19:08:26.692382 IP localhost.46570 > localhost.46686: UDP, length 21
19:08:26.692414 IP localhost.46570 > localhost.46686: UDP, length 21
19:08:26.694446 IP localhost.46686 > localhost.46570: UDP, length 31
19:08:26.705309 IP localhost.46686 > localhost.46570: UDP, length 25
```

**Comment by wwqgtxx** [comment]
We encountered a similar situation. After updating to quic-go 0.58.0, CPU usage increased, with a constant small amount of upstream traffic.

Using pprof, we found that `sendProbePacket`->{`sendPackedCoalescedPacket`, `packPTOProbePacket1RTT`} was consuming most of the CPU time.

Downgrading to quic-go 0.57.1 restored everything to normal.

**Comment by lonnywong** [comment]
I’ve been testing it and noticed:

- `!h.appDataPackets.history.HasOutstandingPackets()` is always `false`:
https://github.com/quic-go/quic-go/blob/2020668fa071bc278891dc8c56c3f4367d988ad6/internal/ackhandler/sent_packet_handler.go#L722-L725

- `!ptoTime.IsZero()` and `pathProbeLossTime.IsZero()` is always `true`:
https://github.com/quic-go/quic-go/blob/2020668fa071bc278891dc8c56c3f4367d988ad6/internal/ackhandler/sent_packet_handler.go#L748-L755

- The `alarmTimer.Time` ( `ptoTime` ) will expire soon, then trigger `sentPacketHandler.OnLossDetectionTimeout` frequently:
https://github.com/quic-go/quic-go/blob/2020668fa071bc278891dc8c56c3f4367d988ad6/connection.go#L679-L680

- If the network is disconnected for about one second and then immediately recovers, the issue becomes more severe and cannot be automatically recovered.

**Comment by marten-seemann** [comment]
Can you provide a qlog of a connection where this happened?

**Comment by lonnywong** [comment]
@marten-seemann 
[client_363736306263386436656361313865623035626230666563646236663766_1768039550732772000.log](https://github.com/user-attachments/files/24541093/client_363736306263386436656361313865623035626230666563646236663766_1768039550732772000.log)
[server_363736306263386436656361313865623035626230666563646236663766_1768039550750646653.log](https://github.com/user-attachments/files/24541092/server_363736306263386436656361313865623035626230666563646236663766_1768039550750646653.log)

**Comment by marten-seemann** [comment]
Thank you @lonnywong! This looks like a bug. I added this issue to the v0.59 milestone (probably going to happen early next week). Would be great if you could test the fix once I have a PR up.

> Downgrading to quic-go 0.57.1 restored everything to normal.

@wwqgtxx Please don't just downgrade, please report issues you're experiencing!

**Comment by marten-seemann** [comment]
@lonnywong @wwqgtxx #5539 should fix this problem. Can you please deploy and report back if it actually resolves the issue?

**Comment by lonnywong** [comment]
@marten-seemann I've tested for a while and can't reproduce the issue anymore. Looks fixed, thanks!

**Comment by wwqgtxx** [comment]
Our tests show that the previous PTO issue has not reappeared, and CPU usage has returned to version v0.57.1.

**Comment by marten-seemann** [comment]
Thanks for testing! I'll cut a new release soon.
