### ISSUE TITLE
can not running client example?

### ISSUE THREAD

**Issue by lastpepole** [quic-go/quic-go#4263]
file: quic-go-0.41.0/example/main.go
run server on A(10.10.10.10) machine:
./main -bind 10.10.10.10:6121 --cert ./openssl/server.crt --key ./openssl/server.key -tcp -www helloworld

file: quic-go-0.41.0/example/client/main.go
run client on B(10.10.10.11) machine:
./main -insecure -keylog ssl.log https://10.10.10.10:6121/

client error:
2024/01/23 15:49:16 GET https://10.10.10.10:6121/
2024/01/23 15:49:16 Get "https://10.10.10.10:6121/": INTERNAL_ERROR (local): write udp 0.0.0.0:48004->10.10.10.10:6121: sendmsg: invalid argument

problem:
how to solve this problem?

**Comment by marten-seemann** [comment]
Might be related to either GSO or ECN (https://github.com/quic-go/quic-go/issues/4178). Try (separately) setting `QUIC_GO_DISABLE_ECN=true` and `QUIC_GO_DISABLE_GSO=true`.

Please let me know if any of them works, and if so, what kind of machine you're running on.

**Comment by lastpepole** [comment]
@marten-seemann 
I do it, find new error.
client error log: Get "https://10.10.10.10:6121/": timeout: no recent network activity.

**Comment by marten-seemann** [comment]
That's not a quic-go problem anymore, you're just running into a network timeout.

**Comment by lastpepole** [comment]
@marten-seemann 
That's a quic-go problem. we find server don't reply client by tcpdump in server side.


tcpdump info:
17:33:25.616234 IP 10.10.10.11.30666 > 10.10.10.10.6121: UDP, length 1252
17:33:25.816330 IP 10.10.10.11.30666 > 10.10.10.10.6121: UDP, length 1252
17:33:25.816337 IP 10.10.10.11.30666 > 10.10.10.10.6121: UDP, length 1252
17:33:26.216811 IP 10.10.10.11.30666 > 10.10.10.10.6121: UDP, length 1252

**Comment by marten-seemann** [comment]
Your connectivity issues are not a quic-go problem. I won't be able to help you debug your network setup for free, sorry!

**Comment by lastpepole** [comment]
@marten-seemann 
I  solve it. 
must set QUIC_GO_DISABLE_ECN=true and QUIC_GO_DISABLE_GSO=true in server side.
thanks.
